{
  "change": "complete-g2-native-acceptance-rows-macos",
  "generatedAt": "2026-10-28T08:17:39.655Z",
  "devCommit": "f6696995dce0b2424e6f0fa20d9dda356507f954",
  "query": {
    "capabilities": [
      "native-worker-acceptance",
      "worker-supervisor",
      "g2-failure-scenarios"
    ],
    "files": [
      "packages/adapters/worker-supervisor*/**",
      "test/g2-scenarios/**",
      "scripts/native*"
    ],
    "top": 7
  },
  "size": "M-L",
  "review": {
    "categories": [
      {
        "category": "docs",
        "count": 13
      },
      {
        "category": "evidence-mismatch",
        "count": 11
      },
      {
        "category": "error-handling",
        "count": 8
      },
      {
        "category": "naming",
        "count": 6
      },
      {
        "category": "missing-fail-before-test",
        "count": 4
      },
      {
        "category": "process",
        "count": 3
      },
      {
        "category": "scope",
        "count": 3
      }
    ],
    "baseline": {
      "all": {
        "findings": 406,
        "inChecklist": 219
      },
      "mediumOrWorse": {
        "findings": 176,
        "inChecklist": 60
      }
    }
  },
  "recordQuality": {
    "categories": [
      {
        "category": "evidence-mismatch",
        "count": 78
      },
      {
        "category": "docs",
        "count": 51
      },
      {
        "category": "spec-wording",
        "count": 42
      },
      {
        "category": "stale-citation",
        "count": 31
      },
      {
        "category": "contract-drift",
        "count": 16
      },
      {
        "category": "process",
        "count": 14
      },
      {
        "category": "scope",
        "count": 6
      }
    ],
    "baseline": {
      "all": {
        "findings": 240,
        "inChecklist": 238
      },
      "mediumOrWorse": {
        "findings": 40,
        "inChecklist": 40
      }
    }
  }
}
