{
  "change": "implement-worker-self-check-admission",
  "generatedAt": "2026-10-27T22:16:01.243Z",
  "devCommit": "46e21ef19e624bc50f264a5b307e3058292ee294",
  "query": {
    "capabilities": [
      "installation-enrollment",
      "worker-platform-foundation",
      "worker-runtime",
      "trust-and-operational-foundation",
      "product-ports",
      "resource-admission"
    ],
    "files": [],
    "top": 7
  },
  "size": "M-L",
  "review": {
    "categories": [
      {
        "category": "contract-drift",
        "count": 25
      },
      {
        "category": "spec-wording",
        "count": 14
      },
      {
        "category": "docs",
        "count": 7
      },
      {
        "category": "naming",
        "count": 5
      },
      {
        "category": "redaction",
        "count": 2
      },
      {
        "category": "concurrency-race",
        "count": 1
      },
      {
        "category": "error-handling",
        "count": 1
      }
    ],
    "baseline": {
      "all": {
        "findings": 300,
        "inChecklist": 248
      },
      "mediumOrWorse": {
        "findings": 120,
        "inChecklist": 103
      }
    }
  },
  "recordQuality": {
    "categories": [
      {
        "category": "evidence-mismatch",
        "count": 60
      },
      {
        "category": "docs",
        "count": 45
      },
      {
        "category": "spec-wording",
        "count": 26
      },
      {
        "category": "stale-citation",
        "count": 23
      },
      {
        "category": "process",
        "count": 11
      },
      {
        "category": "contract-drift",
        "count": 9
      },
      {
        "category": "scope",
        "count": 5
      }
    ],
    "baseline": {
      "all": {
        "findings": 179,
        "inChecklist": 179
      },
      "mediumOrWorse": {
        "findings": 29,
        "inChecklist": 29
      }
    }
  }
}
