{
  "change": "assert-worker-image-admission",
  "generatedAt": "2026-10-28T04:55:59.331Z",
  "devCommit": "1c73e1a70d92fab0883f3972672dd56b1d01ae77",
  "query": {
    "capabilities": [
      "local-installation",
      "installation-enrollment",
      "worker-runtime"
    ],
    "files": [],
    "top": 7
  },
  "size": "S-M",
  "review": {
    "categories": [
      {
        "category": "error-handling",
        "count": 8
      },
      {
        "category": "contract-drift",
        "count": 7
      },
      {
        "category": "docs",
        "count": 5
      },
      {
        "category": "missing-fail-before-test",
        "count": 5
      },
      {
        "category": "redaction",
        "count": 5
      },
      {
        "category": "spec-wording",
        "count": 5
      },
      {
        "category": "evidence-mismatch",
        "count": 3
      }
    ],
    "baseline": {
      "all": {
        "findings": 379,
        "inChecklist": 307
      },
      "mediumOrWorse": {
        "findings": 158,
        "inChecklist": 135
      }
    }
  },
  "recordQuality": {
    "categories": [
      {
        "category": "evidence-mismatch",
        "count": 71
      },
      {
        "category": "docs",
        "count": 49
      },
      {
        "category": "spec-wording",
        "count": 40
      },
      {
        "category": "stale-citation",
        "count": 29
      },
      {
        "category": "contract-drift",
        "count": 14
      },
      {
        "category": "process",
        "count": 14
      },
      {
        "category": "scope",
        "count": 6
      }
    ],
    "baseline": {
      "all": {
        "findings": 225,
        "inChecklist": 223
      },
      "mediumOrWorse": {
        "findings": 35,
        "inChecklist": 35
      }
    }
  }
}
